ts_utc,action,symbol,verdict,reason,qty,price,usd,cash_after,equity_after,thesis
2026-07-22T14:20:00Z,buy,ETH-USD,approved,ok,0.031035,1933.30,60.00,383.03,502.68,"ETH is the only strong name on the board at +3.86% and the sole non-correlated asset while equities sell off, so I add to the winner and concentrate the account in the one working momentum trade."
2026-07-22T14:30:00Z,buy,ETH-USD,vetoed,position would exceed 25% of equity,,,,383.03,502.11,ETH is the only green asset on a broadly red tape at +3.37% and non-correlated to the equity selloff — adding on the shallow pullback to $1924 keeps my momentum leader position under the 25% cap.
2026-07-22T14:30:00Z,hold,none,approved,hold,,,,383.03,502.11,"Every equity name is bleeding with no reversal candle — META -7.58% and GOOGL -6.26% are falling knives I already cut, so no new equity risk this cycle."
2026-07-22T14:40:00Z,buy,BTC-USD,approved,ok,0.000837,65686.51,55.00,328.03,502.45,"BTC at +1.37% is the only other green, non-correlated asset on a uniformly red equity tape and adds a second crypto momentum leg without breaching the 25% single-position cap."
2026-07-22T14:40:00Z,buy,ETH-USD,vetoed,position would exceed 25% of equity,,,,328.03,502.45,"ETH is the strongest name on the board at +3.66% and my existing lot is only -0.49% underwater, so I add on the shallow pullback rather than fight the equity bleed."
2026-07-22T14:50:00Z,sell,ETH-USD,approved,ok,-0.061887,1929.24,119.39,447.43,502.45,ETH is up +3.65% on the day but my lot is underwater at -0.51% and momentum has faded from +3.86% to +3.65% across the last three cycles while the entire equity tape bleeds — take the loss small and free capital rather than average into a stalling move.
2026-07-22T14:50:00Z,buy,BTC-USD,approved,ok,0.000913,65706.24,60.00,387.43,502.45,"BTC is the only asset still extending on the day (+1.37% to +1.40%) and my existing lot is green, so add a small tranche to the one name with intact upward momentum while staying under the 25% single-position cap."
2026-07-22T15:00:00Z,buy,ETH-USD,approved,ok,0.028458,1932.70,55.00,332.43,502.55,"ETH is the strongest asset on the board at +3.83% and still extending while every equity name bleeds, so I want a fresh momentum lot in the only non-correlated leader."
2026-07-22T15:00:00Z,buy,BTC-USD,vetoed,position would exceed 25% of equity,,,,332.43,502.55,"BTC extended from +1.40% to +1.50% since last cycle and my existing lot just flipped green, so I add a small tranche to the working trend while staying under the 25% position cap."
2026-07-22T15:10:00Z,sell,ETH-USD,approved,ok,-0.028458,1936.44,55.11,387.54,502.79,"ETH is up +4.03% on the day and my lot is green at +0.19% — take the profit into strength while the entire equity board bleeds red, since a crypto reversal into a risk-off tape would erase this fast."
2026-07-22T15:10:00Z,buy,BTC-USD,vetoed,position would exceed 25% of equity,,,,387.54,502.79,BTC extended to +1.62% and my existing lot is green at +0.23% — add a small tranche to the only asset holding a clean uptrend on an otherwise uniformly red board.
2026-07-22T15:20:00Z,sell,BTC-USD,approved,ok,-0.001750,65955.34,115.45,502.99,502.99,"BTC is up +1.79% and my lot is green at +0.39% — take the scalp profit into strength while every equity on the board is bleeding, and go to cash rather than chase a broad-market risk-off tape."
2026-07-22T15:30:00Z,buy,ETH-USD,approved,ok,0.033340,1949.60,65.00,437.99,502.99,ETH is the strongest thing on the board at +4.74% and still extending while every equity is red — re-enter the same momentum leg I already scalped once today.
2026-07-22T15:30:00Z,buy,BTC-USD,approved,ok,0.000833,66052.93,55.00,382.99,502.99,"BTC at +1.94% is the second-best relative-strength name and crypto is the only green sector, so take a small trailing position alongside ETH."
2026-07-22T15:40:00Z,buy,ETH-USD,approved,ok,0.025741,1942.40,50.00,332.99,502.66,ETH is still the strongest name on the board at +4.35% while every equity is red — add to the momentum leader on this shallow pullback to my avg.
2026-07-22T15:40:00Z,sell,BTC-USD,approved,ok,-0.000833,65949.49,54.91,387.90,502.66,BTC momentum has stalled (+1.94% down to +1.78%) and my lot is red — cut the weaker crypto leg fast and concentrate into ETH.
2026-07-22T15:50:02Z,buy,ETH-USD,vetoed,position would exceed 25% of equity,,,,387.90,502.79,ETH is the only strong name on the board at +4.47% while every equity is red; add to the momentum leader on the shallow pullback to 1944.
2026-07-22T16:00:00Z,buy,ETH-USD,vetoed,position would exceed 25% of equity,,,,387.90,502.64,"ETH is still the only green momentum name on a broadly red tape at +4.33% and holding near session highs, so I'm adding to the winner while equities bleed."
2026-07-22T16:00:00Z,buy,BTC-USD,approved,ok,0.000682,66012.71,45.00,342.90,502.64,"BTC at +1.88% is the second-best relative-strength name and is re-firming off the 65.9k dip I sold, so I'm re-entering small for the crypto-strength pair trade."
2026-07-22T16:10:00Z,sell,BTC-USD,approved,ok,-0.000682,66097.87,45.06,387.96,502.84,BTC is green +0.13% on my lot but has stalled in a 66k range for three cycles while ETH runs — take the small win and concentrate into the leader.
2026-07-22T16:10:00Z,buy,ETH-USD,vetoed,position would exceed 25% of equity,,,,387.96,502.84,ETH is the strongest name on the board at +4.46% and firming into the highs while every equity is red — add to the only real momentum on the tape.
2026-07-22T16:20:00Z,buy,ETH-USD,vetoed,position would exceed 25% of equity,,,,387.96,502.63,ETH is the lone strong name at +4.27% on a broadly red tape and is holding near highs — add to the existing lot rather than sit flat with 77% of equity in cash.
2026-07-22T16:30:00Z,buy,ETH-USD,vetoed,position would exceed 25% of equity,,,,387.96,502.51,"ETH is the lone strong name at +4.16% on a broadly red tape and I already hold a small lot near breakeven, so I'm adding to the only working momentum leader rather than sitting flat again."
2026-07-22T16:40:00Z,buy,ETH-USD,vetoed,position would exceed 25% of equity,,,,387.96,503.45,ETH is the strongest name on the board at +5.01% and making new highs while everything else bleeds; adding to my winning lot keeps total ETH exposure near 33 percent of equity... trimming to stay under the 25 percent cap.
2026-07-22T16:40:00Z,buy,BTC-USD,approved,ok,0.000904,66341.50,60.00,327.96,503.45,"BTC is the only other green name at +2.38% and has broken out of the 66k range it stalled in earlier, so crypto strength is broadening rather than being ETH-only."
2026-07-22T16:50:01Z,sell,ETH-USD,approved,ok,-0.059082,1947.58,115.07,443.03,502.87,ETH is up +4.63% and printing new highs while every equity name is deeply red — take the profit into strength rather than hold a 22% position into a risk-off tape.
2026-07-22T16:50:01Z,buy,BTC-USD,approved,ok,0.000907,66168.15,60.00,383.03,502.87,BTC is holding +2.12% and the only other green name on a broadly red board — add a small tranche to the existing lot to ride crypto strength with less extension risk than ETH.
2026-07-22T17:00:00Z,buy,ETH-USD,approved,ok,0.030783,1949.10,60.00,323.03,502.94,ETH is the strongest name on the board at +4.71% making new highs while every equity is red — take the momentum leader with a 12% starter rather than adding a third BTC tranche.
2026-07-22T17:00:00Z,sell,BTC-USD,approved,ok,-0.000680,66204.83,45.00,368.03,502.94,BTC is flat against my average after two adds and lagging ETH badly on the same crypto bid — trim a third of the position to fund the stronger horse.
2026-07-22T17:10:01Z,sell,BTC-USD,approved,ok,-0.001131,66172.60,74.87,442.90,502.86,BTC has stalled flat against my average and is badly lagging ETH's +4.64% on the same risk-on tape — recycle the capital into the leader.
2026-07-22T17:10:01Z,buy,ETH-USD,approved,ok,0.030804,1947.78,60.00,382.90,502.86,ETH is the strongest name on the board at +4.64% making new highs while every equity name is deeply red — add to the clear momentum leader.
2026-07-22T17:20:01Z,sell,ETH-USD,approved,ok,-0.061588,1941.30,119.56,502.46,502.46,"ETH has faded from +4.71% to +4.29% and my position is underwater against a 1948 average after three adds — momentum is rolling over, so take the small loss and go flat rather than average down again."
2026-07-22T17:20:01Z,buy,BTC-USD,approved,ok,0.000909,66035.58,60.00,442.46,502.46,BTC is the only other green name on a deeply red board at +1.91% and has held its gains while ETH fades — rotate a small 12% starter into the steadier crypto leg.
2026-07-22T17:30:00Z,sell,BTC-USD,approved,ok,-0.000909,65959.01,59.93,502.39,502.39,BTC is underwater against my 66035 average and its +1.79% is fading while ETH accelerates to +3.98% — cut the laggard and free the cash.
2026-07-22T17:30:00Z,buy,ETH-USD,approved,ok,0.031001,1935.40,60.00,442.39,502.39,"ETH is the clear momentum leader at +3.98% on a board where every equity is red, so rotate the crypto exposure into the strongest name."
2026-07-22T17:40:01Z,sell,ETH-USD,approved,ok,-0.031001,1941.68,60.19,502.58,502.58,ETH is only +0.32% against my average after fading from +4.71% earlier and the last three cycles of round-tripping between ETH and BTC have bled the account; take the small green and reset.
2026-07-22T17:40:01Z,buy,BTC-USD,approved,ok,0.000908,66106.92,60.00,442.58,502.58,"BTC at +2.02% is making the session's best relative structure while ETH decays off its high, so rotate a 12% starter into the steadier crypto leader on a board where every equity is red."
2026-07-22T17:50:00Z,sell,BTC-USD,approved,ok,-0.000908,66117.19,60.01,502.59,502.59,"BTC is only +0.02% against my average after three straight churn cycles and its +2.04% is stalling while ETH has accelerated to +4.42%, so I rotate the capital to the stronger leg."
2026-07-22T17:50:00Z,buy,ETH-USD,approved,ok,0.033442,1943.67,65.00,437.59,502.59,"ETH is the session's clear momentum leader at +4.42%, well above its earlier +3.98% fade level, and it is the only name making new highs on a board where every equity is deeply red."
2026-07-22T18:00:00Z,sell,ETH-USD,approved,ok,-0.033442,1937.74,64.80,502.40,502.40,"ETH has faded from +4.42% at my entry to +4.10% and sits 0.31% underwater after three straight losing churn cycles, so I cut it before the fade extends."
2026-07-22T18:00:00Z,buy,BTC-USD,approved,ok,0.000909,66000.94,60.00,442.40,502.40,"BTC at +1.86% is the only other green name on an ugly tape and is holding a steadier uptrend than ETH's decaying spike, so I rotate a small 12% stake into the firmer crypto leg."
2026-07-22T18:10:00Z,sell,BTC-USD,approved,ok,-0.000909,65970.25,59.97,502.37,502.37,"BTC has stalled at -0.05% against my average after fading from +2.02% earlier in the session, and the churn is bleeding the account."
2026-07-22T18:10:00Z,buy,ETH-USD,approved,ok,0.031050,1932.34,60.00,442.37,502.37,ETH at +3.81% is the strongest name on the tape and has re-accelerated off its earlier fade while every equity index and megacap is deeply red.
2026-07-22T18:20:00Z,sell,ETH-USD,approved,ok,-0.031050,1936.80,60.14,502.51,502.51,ETH has faded from +4.42% earlier to +4.05% and my position is only +0.23% after a full cycle of chop — take the small win rather than round-trip it a fourth time.
2026-07-22T18:20:00Z,buy,BTC-USD,approved,ok,0.000910,65967.08,60.00,442.51,502.51,"BTC at +1.81% is the only other green name on a broadly red tape (META -8%, GOOGL -6.6%, TSLA -4.8%) and has been the steadier of the two crypto legs, so rotate the crypto exposure there for a ~12% equity clip."
2026-07-22T18:30:00Z,sell,BTC-USD,approved,ok,-0.000910,65834.44,59.88,502.39,502.39,"BTC has faded from +1.81% at entry to +1.60% and the position is -0.20% underwater with no re-acceleration, so cut it fast per the tight-stop rule."
2026-07-22T18:30:00Z,buy,ETH-USD,approved,ok,0.031068,1931.26,60.00,442.39,502.39,"ETH at +3.75% is by far the strongest name on a deeply red tape and is holding its gain while BTC fades, so rotate crypto exposure into the relative-strength leader."
2026-07-22T18:40:00Z,hold,none,approved,hold,,,,442.39,502.14,"ETH remains the strongest name on a deeply red tape at +3.33% and my position is only -0.41% underwater with no better setup elsewhere — everything else is bleeding, so I hold the leader rather than chase a falling knife."
2026-07-22T18:50:00Z,sell,ETH-USD,approved,ok,-0.031068,1926.82,59.86,502.25,502.25,ETH momentum has decayed from +4.4% to +3.5% while my position sits underwater at -0.23%; cut it and go flat rather than hold a fading leader on a tape where every equity name is red.
2026-07-22T18:50:00Z,buy,BTC-USD,approved,ok,0.000912,65780.20,60.00,442.25,502.25,"BTC is the only name still expanding today at +1.52% with none of ETH's intraday fade, so rotate the crypto exposure into the steadier leg for a fast momentum scalp."
2026-07-22T19:00:00Z,sell,BTC-USD,approved,ok,-0.000912,65864.26,60.08,502.32,502.32,BTC's momentum is flattening at +1.65% while the position sits at only +0.13% — take the small gain and rotate into the day's strongest expanding name.
2026-07-22T19:00:00Z,buy,ETH-USD,approved,ok,0.031090,1929.88,60.00,442.32,502.32,"ETH at +3.68% is re-accelerating and is by far the strongest name on a deeply red tape, leading BTC by more than 2 points of relative strength."
2026-07-22T19:10:00Z,sell,ETH-USD,approved,ok,-0.031090,1925.16,59.85,502.18,502.18,ETH momentum has faded from +3.68% at entry to +3.43% and the position is underwater again — cut it rather than round-trip a third time.
2026-07-22T19:10:00Z,buy,BTC-USD,approved,ok,0.000912,65754.98,60.00,442.18,502.18,"BTC at +1.48% is the only crypto holding a steady uptrend without ETH's intraday decay, and it's the sole green name outside ETH on a broadly red tape."
2026-07-22T19:20:00Z,sell,BTC-USD,approved,ok,-0.000912,65822.42,60.06,502.24,502.24,"BTC has stalled at +1.58% with the position only +0.10% after two flat cycles, so I'm rotating out of the laggard."
2026-07-22T19:20:00Z,buy,ETH-USD,approved,ok,0.031139,1926.85,60.00,442.24,502.24,"ETH at +3.52% is more than double BTC's move and is the strongest name on the board on a broadly red equity tape, so I'm putting the crypto allocation where the momentum actually is."
2026-07-22T19:30:00Z,sell,ETH-USD,approved,ok,-0.031139,1926.12,59.98,502.22,502.22,"ETH has faded from +3.52% at entry to +3.48% with the position underwater and the last three crypto rotations all producing flat-to-negative churn, so I'm taking the position off rather than paying spread for another sideways cycle."
2026-07-22T19:30:00Z,buy,META,approved,ok,0.095680,627.09,60.00,442.22,502.22,"META at -7.96% is by far the most oversold name on the board and a washed-out mega-cap into afternoon is the highest-probability mean-reversion snap available, sized at ~12% of equity with a fast exit if it keeps bleeding."
2026-07-22T19:40:00Z,sell,META,approved,ok,-0.095680,625.25,59.82,502.04,502.04,"The oversold-bounce thesis on META has not paid — it slid from -7.96% to -8.23% while underwater, so cut it and stop catching a falling knife."
2026-07-22T19:40:00Z,buy,ETH-USD,approved,ok,0.031160,1925.55,60.00,442.04,502.04,ETH at +3.45% is the strongest name on the board by a wide margin and the only asset with real upside momentum while every equity bleeds.
2026-07-22T19:50:01Z,sell,ETH-USD,approved,ok,-0.031160,1925.46,60.00,502.04,502.04,ETH has been flat at +3.44% for two cycles with the position at breakeven — recycle the capital rather than pay round-trip friction on a stalled move.
2026-07-22T19:50:01Z,buy,BTC-USD,approved,ok,0.000911,65872.95,60.00,442.04,502.04,"BTC at +1.66% is the only name still building on its move while the entire equity board is red, so rotate the crypto exposure into the one chart that is still trending up rather than the one that has gone flat."
2026-07-22T20:00:01Z,sell,BTC-USD,approved,ok,-0.000911,65830.13,59.96,502.00,502.00,BTC has stalled at +1.60% and the position is underwater after two cycles of no follow-through — recycle capital rather than bleed.
2026-07-22T20:00:01Z,buy,ETH-USD,approved,ok,0.031192,1923.54,60.00,442.00,502.00,"ETH at +3.34% is the strongest mover on the board while every equity name is red, and it is still the only asset making upside progress."
2026-07-22T20:10:00Z,sell,ETH-USD,approved,ok,-0.031192,1925.07,60.05,502.05,502.05,ETH has decayed from +3.45% to +3.42% over three cycles with the position stuck at breakeven — the move is exhausted and holding it ties up capital in a stalled leader.
2026-07-22T20:10:00Z,buy,BTC-USD,approved,ok,0.000912,65789.42,60.00,442.05,502.05,"BTC is the only name on the board making a fresh push (+1.53% and rebuilding after its earlier stall) while every equity is closed and red, so I rotate into the one live asset showing renewed upside momentum."
2026-07-22T20:20:00Z,sell,BTC-USD,approved,ok,-0.000912,65905.54,60.11,502.15,502.15,BTC is up only +0.18% on the position and its +1.71% day move is lagging ETH badly — recycle the capital into the stronger leg.
2026-07-22T20:20:00Z,buy,ETH-USD,approved,ok,0.033714,1927.99,65.00,437.15,502.15,"ETH at +3.58% is the strongest and still-expanding mover on the board while every equity name is red and untradable, so it gets the crypto allocation this cycle."
2026-07-22T20:30:00Z,sell,ETH-USD,approved,ok,-0.033714,1926.67,64.96,502.11,502.11,"ETH has flatlined at +3.51% and the position is slightly underwater after a full cycle with no follow-through, while BTC is the only name accelerating."
2026-07-22T20:30:00Z,buy,BTC-USD,approved,ok,0.000910,65898.55,60.00,442.11,502.11,BTC at +1.70% is making a fresh push off its intraday base and is the only asset on the board still expanding while every equity name is closed and red.
2026-07-22T20:40:00Z,sell,BTC-USD,approved,ok,-0.000910,65906.62,60.01,502.11,502.11,BTC is flat at +0.01% on the position while ETH has expanded from +3.42% to +3.52% — rotate out of the laggard.
2026-07-22T20:40:00Z,buy,ETH-USD,approved,ok,0.031138,1926.90,60.00,442.11,502.11,"ETH is the strongest and still-expanding mover on the board at +3.52%, doubling BTC's day gain, so take a ~12% equity entry on the leader."
2026-07-22T20:50:01Z,sell,ETH-USD,approved,ok,-0.031138,1925.86,59.97,502.08,502.08,ETH has stalled at +3.46% after three cycles of chop and the position is underwater with no expansion left in the move.
2026-07-22T20:50:01Z,buy,BTC-USD,approved,ok,0.000911,65887.97,60.00,442.08,502.08,"BTC is the only asset still expanding on the day at +1.68% off its base while every equity name is deeply red and untradable, so rotate the crypto allocation into the mover with room left."
2026-07-22T21:00:00Z,sell,BTC-USD,approved,ok,-0.000911,65892.16,60.00,502.09,502.09,BTC is dead flat at +0.01% on the position and its intraday momentum has decayed to +1.69% while ETH has expanded from +3.46% to +3.47% and holds the strongest trend on the board.
2026-07-22T21:00:00Z,buy,ETH-USD,approved,ok,0.031154,1925.94,60.00,442.09,502.09,"ETH is the top momentum name at +3.47% and roughly double BTC's daily gain, so I'm rotating the freed capital plus a small add into the leader for the next leg."
2026-07-22T21:10:00Z,sell,ETH-USD,approved,ok,-0.031154,1928.60,60.08,502.17,502.17,ETH has flattened at +3.61% after four cycles of chop and the position is only +0.14% — take the scratch profit off the table before it rolls over.
2026-07-22T21:10:00Z,buy,BTC-USD,approved,ok,0.000911,65891.72,60.00,442.17,502.17,"BTC at +1.69% is the only crypto still building on the day rather than stalling, so rotate the freed capital into the expanding mover with a ~12% equity entry."
2026-07-22T21:20:00Z,sell,BTC-USD,approved,ok,-0.000911,65887.43,60.00,502.16,502.16,"BTC is flat at -0.01% on the position and has stopped extending, so I'm freeing the capital rather than paying chop."
2026-07-22T21:20:00Z,buy,ETH-USD,approved,ok,0.031135,1927.10,60.00,442.16,502.16,"ETH at +3.53% is re-accelerating and is now more than double BTC's daily gain, making it the strongest live momentum name available while equities are closed."
2026-07-22T21:30:00Z,sell,ETH-USD,approved,ok,-0.031135,1926.96,60.00,502.16,502.16,"ETH is flat at -0.01% on the position and has stalled at +3.5% for three cycles, so I'm freeing the capital."
2026-07-22T21:30:00Z,buy,BTC-USD,approved,ok,0.000911,65878.01,60.00,442.16,502.16,"BTC at +1.67% is the only crypto still quietly extending rather than chopping sideways, so I rotate into it for the next leg."
2026-07-22T21:40:00Z,sell,BTC-USD,approved,ok,-0.000911,66039.60,60.15,502.31,502.31,"BTC is up +0.25% on the position but only +1.92% on the day versus ETH's +3.83%, so I'm rotating out of the laggard while the small gain is real."
2026-07-22T21:40:00Z,buy,ETH-USD,approved,ok,0.036218,1932.72,70.00,432.31,502.31,ETH at +3.83% is the strongest and still-extending name on the board — double BTC's daily move — so I'm putting ~14% of equity into the leader.
2026-07-22T21:50:00Z,sell,ETH-USD,approved,ok,-0.036218,1935.98,70.12,502.43,502.43,"ETH is only +0.17% on the position and has spent four cycles pinned between +3.5% and +4.0% while BTC has quietly accelerated from +1.67% to +2.00%, so I'm rotating out of the stalled leader."
2026-07-22T21:50:00Z,buy,BTC-USD,approved,ok,0.000983,66091.16,65.00,437.43,502.43,"BTC is the one name still making higher daily prints cycle over cycle, so I'm putting ~13% of equity into the actively extending crypto instead of the chopping one."
2026-07-22T22:00:00Z,sell,BTC-USD,approved,ok,-0.000983,66041.25,64.95,502.38,502.38,"BTC is flat at -0.08% on the position and has been rotated into twice with no follow-through, so I'm freeing the capital rather than paying spread on a stalled name."
2026-07-22T22:00:00Z,buy,ETH-USD,approved,ok,0.033561,1936.79,65.00,437.38,502.38,"ETH at +4.05% is now making a new daily high and leading BTC by more than 2x on the day, so I'm taking a fresh ~13% equity entry on the strongest extending name."
2026-07-22T22:10:00Z,sell,ETH-USD,approved,ok,-0.033561,1935.21,64.95,502.32,502.32,"ETH is flat at -0.08% on the position and has stalled after its new daily high while BTC keeps grinding higher, so I'm cutting the dead trade."
2026-07-22T22:10:00Z,buy,BTC-USD,approved,ok,0.000985,65979.15,65.00,437.32,502.32,"BTC at +1.83% is the only name still making higher prints into a quiet tape, so I'm rotating a ~13% equity clip into the steadier trend."
2026-07-22T22:20:00Z,sell,BTC-USD,approved,ok,-0.000985,65963.66,64.98,502.31,502.31,"BTC has gone flat again at -0.02% after three straight round-trips with no follow-through, so I'm cutting the dead position and freeing the capital."
2026-07-22T22:20:00Z,buy,ETH-USD,approved,ok,0.036207,1933.32,70.00,432.31,502.31,"ETH at +3.86% is more than double BTC's daily gain and is the only name with real relative strength in a tape where every equity is red, so I'm rotating into the leader with a ~14% equity entry."
2026-07-22T22:30:00Z,sell,ETH-USD,approved,ok,-0.036207,1935.33,70.07,502.38,502.38,"ETH is flat at +0.10% after four straight round-trips with no follow-through, so I'm taking the tiny gain and stepping aside rather than paying spread on a fifth chop."
2026-07-22T22:30:00Z,buy,BTC-USD,approved,ok,0.000909,65991.32,60.00,442.38,502.38,"With crypto the only tradable tape and ETH stalling under its daily high, I'm rotating a small 12% starter into BTC at +1.84% where the grind higher is steadier."
2026-07-22T22:40:00Z,sell,BTC-USD,approved,ok,-0.000909,65918.71,59.93,502.32,502.32,"BTC has again gone flat at -0.11% after the rotation with no follow-through, so I'm cutting it rather than paying spread on a stalled tape."
2026-07-22T22:40:00Z,buy,ETH-USD,approved,ok,0.033644,1932.00,65.00,437.32,502.32,"ETH at +3.79% is more than double BTC's daily gain and remains the strongest tradable momentum name, so I'm sizing ~13% of equity into the leader."
2026-07-22T22:50:00Z,sell,ETH-USD,approved,ok,-0.033644,1932.97,65.03,502.35,502.35,"ETH has stalled at +0.05% since entry with no follow-through after five straight round-trips, so I'm cutting the dead position rather than paying spread on chop."
2026-07-22T22:50:00Z,buy,BTC-USD,approved,ok,0.000985,65997.83,65.00,437.35,502.35,"BTC at +1.85% is the only tradable name still holding an uptrend without ETH's exhausted parabolic extension, so I'm rotating a ~13% equity clip there."
2026-07-22T23:00:00Z,sell,BTC-USD,approved,ok,-0.000985,66017.99,65.02,502.37,502.37,"BTC has gone flat at +0.03% since entry with no follow-through, so I'm cutting the dead position and rotating to the stronger tape."
2026-07-22T23:00:00Z,buy,ETH-USD,approved,ok,0.033549,1937.45,65.00,437.37,502.37,"ETH at +4.09% is more than double BTC's daily gain and is the strongest momentum name on the only tradable tape, so I'm putting ~13% of equity behind the leader."
2026-07-22T23:10:00Z,sell,ETH-USD,approved,ok,-0.033549,1935.50,64.93,502.30,502.30,"ETH is flat at -0.10% since entry with no follow-through after another 10-minute hold, so I'm cutting it and rotating."
2026-07-22T23:10:00Z,buy,BTC-USD,approved,ok,0.000909,66033.13,60.00,442.30,502.30,"BTC at +1.91% is grinding higher steadily while ETH stalls at its +4% extension, making it the better momentum vehicle for this cycle."
2026-07-22T23:20:00Z,sell,BTC-USD,approved,ok,-0.000909,65862.17,59.84,502.15,502.15,"BTC has rolled over to -0.26% since entry and its daily gain faded from +1.91% to +1.64%, so I cut the loser fast."
2026-07-22T23:20:00Z,buy,ETH-USD,approved,ok,0.031157,1925.74,60.00,442.15,502.15,ETH at +3.46% is more than double BTC's daily strength and is the only tradable name with real momentum while equities are closed.
